{
  "schema": "joan.update-policy.v0",
  "official_repository": "Yoanybx/joan",
  "enabled": false,
  "channel": "alpha",
  "automatic_updates": false,
  "explicit_tag_required": true,
  "github_attestation_required": true,
  "checksum_required": true,
  "self_check_required": true,
  "rollback_binary_required": true,
  "authority": "LED ACTION LLC"
}
